userid;username;date;time;retweets;favorites;text;geo;mentions;hashtags;tweetid;permalink
19025957;TTCnotices;2017-01-27;06:52;5;0;"ALL CLEAR: The delay at Queen and Yonge has cleared. 501 Queen has returned to regular routing. # TTC";;;# TTC;"824948085491109888";https://twitter.com/TTCnotices/status/824948085491109888
19025957;TTCnotices;2017-01-27;06:36;3;0;"501 Queen holding eastbound at Queen and Yonge due to a stalled streetcar. # TTC";;;# TTC;"824944288203145217";https://twitter.com/TTCnotices/status/824944288203145217
19025957;TTCnotices;2017-01-26;20:21;0;4;"ALL CLEAR: The delay at Queen and Degrassi has cleared. 501 Queen has returned to regular routing. # TTC";;;# TTC;"824789412496146432";https://twitter.com/TTCnotices/status/824789412496146432
19025957;TTCnotices;2017-01-26;19:45;1;0;"UPDATE: 501 Queen diverting both ways via Parliament, Gerrard, Coxwell due to stalled Streetcar at Queen and Degrassi. # TTC";;;# TTC;"824780275892760577";https://twitter.com/TTCnotices/status/824780275892760577
19025957;TTCnotices;2017-01-26;19:32;0;0;"501 Queen holding eastbound on Queen at Degrassi due to emergency overhead repair. # TTC";;;# TTC;"824777147797663744";https://twitter.com/TTCnotices/status/824777147797663744
19025957;TTCnotices;2017-01-26;08:50;1;0;"ALL CLEAR: The delay at Queen and Boulton has cleared. 501 Queen route has returned to regular routing. # TTC";;;# TTC;"824615414831443977";https://twitter.com/TTCnotices/status/824615414831443977
19025957;TTCnotices;2017-01-26;08:48;1;0;"501 Queen route is holding westbound at Queen and Boulton due to a stalled streetcar.";;;;"824615070189641728";https://twitter.com/TTCnotices/status/824615070189641728
19025957;TTCnotices;2017-01-25;19:51;0;2;"ALL CLEAR: The delay on Dufferin at Liberty has now cleared. 501 Queen/514 Cherry routes have resumed regular routing. # TTC";;;# TTC;"824419485083955200";https://twitter.com/TTCnotices/status/824419485083955200
19025957;TTCnotices;2017-01-25;17:16;0;0;"501 Queen (Longbranch Buses Only) turning back westbound via Shaw, King, Dufferin due to a collision on Dufferin at Liberty. # TTC";;;# TTC;"824380476693577729";https://twitter.com/TTCnotices/status/824380476693577729
19025957;TTCnotices;2017-01-25;13:38;0;1;"ALL CLEAR: The delay at Queen and Dufferin has cleared. 501 Queen has resumed regular routing. # TTC";;;# TTC;"824325595979022336";https://twitter.com/TTCnotices/status/824325595979022336
19025957;TTCnotices;2017-01-25;13:31;0;0;"501 Queen holding westbound at Queen and Dufferin, due to a Toronto Police Investigation. # TTC";;;# TTC;"824323946241785865";https://twitter.com/TTCnotices/status/824323946241785865
19025957;TTCnotices;2017-01-24;17:01;1;0;"All Clear: the delay at Bathurst and Queen is now clear. 501 Queen back to regular routing. # TTC";;;# TTC;"824014295847542786";https://twitter.com/TTCnotices/status/824014295847542786
19025957;TTCnotices;2017-01-24;16:54;0;2;"Update: 501 diverting westbound via Spadina, King, Shaw due to a stalled streetcar at Queen and Bathurst. # TTC";;;# TTC;"824012486844227589";https://twitter.com/TTCnotices/status/824012486844227589
19025957;TTCnotices;2017-01-24;16:40;0;1;"501 Queen holding westbound at Queen and Bathurst due to a stalled streetcar. # TTC";;;# TTC;"824008932922429441";https://twitter.com/TTCnotices/status/824008932922429441
19025957;TTCnotices;2017-01-23;20:58;0;1;"ALL CLEAR: The delay on Queen and Maclean has now cleared. 501 Queen has resumed regular routing. # TTC";;;# TTC;"823711633620996096";https://twitter.com/TTCnotices/status/823711633620996096
19025957;TTCnotices;2017-01-23;20:43;0;1;"501 Queen service turning back at Kingston Road due to a collision on Queen at Maclean. # TTC";;;# TTC;"823707774441975808";https://twitter.com/TTCnotices/status/823707774441975808
19025957;TTCnotices;2017-01-23;10:25;0;0;"ALL CLEAR: The delay at Queen and Broadview has cleared. 501 Queen has returned to regular routing. # TTC";;;# TTC;"823552166858145793";https://twitter.com/TTCnotices/status/823552166858145793
19025957;TTCnotices;2017-01-23;09:59;0;0;"501 Queen route diverting eastbound via Parliament, Dundas, Broadview, due to a collision at Queen and Broadview. # TTC";;;# TTC;"823545605020614656";https://twitter.com/TTCnotices/status/823545605020614656
19025957;TTCnotices;2017-01-21;15:28;1;2;"ALL CLEAR: The delay at Queen and University has now cleared. 501 Queen,505 Dundas,506 Carlton routes have resumed regular routing. # TTC";;;# TTC;"822903679254663168";https://twitter.com/TTCnotices/status/822903679254663168
19025957;TTCnotices;2017-01-21;14:26;8;5;"501 Queen route diverting Spadina, King, Church both ways due to a womens rally at Queen and University. # TTC";;;# TTC;"822888233864458240";https://twitter.com/TTCnotices/status/822888233864458240
19025957;TTCnotices;2017-01-20;10:52;1;0;"ALL CLEAR: The delay at Queen and Jones has cleared. 501 Queen has returned to regular routing. # TTC";;;# TTC;"822471838349611008";https://twitter.com/TTCnotices/status/822471838349611008
19025957;TTCnotices;2017-01-20;10:27;0;2;"501 Queen holding westbound at Queen and Jones due to a stalled streetcar. # TTC";;;# TTC;"822465485077966848";https://twitter.com/TTCnotices/status/822465485077966848
19025957;TTCnotices;2017-01-20;09:15;1;1;"ALL CLEAR: The delay at Queen and Bellwoods has cleared. 501 Queen has returned to regular routing. # TTC";;;# TTC;"822447529157595136";https://twitter.com/TTCnotices/status/822447529157595136
19025957;TTCnotices;2017-01-20;09:11;1;0;"501 Queen holding westbound at Queen and Bellwoods due to a collision blocking the rails. # TTC";;;# TTC;"822446545517899778";https://twitter.com/TTCnotices/status/822446545517899778
19025957;TTCnotices;2017-01-19;17:43;0;0;"ALL CLEAR: The delay at Queen and Bathurst has cleared. 501 Queen has returned to regular routing. # TTC";;;# TTC;"822212902090403841";https://twitter.com/TTCnotices/status/822212902090403841
19025957;TTCnotices;2017-01-19;17:21;1;0;"501 Queen holding eastbound on Queen at Bathurst due to a medical emergency on a streetcar. # TTC";;;# TTC;"822207416112648192";https://twitter.com/TTCnotices/status/822207416112648192
19025957;TTCnotices;2017-01-18;06:06;1;0;"ALL CLEAR: The delay at Queen and Connaught has cleared. 501 Queen has returned to regular routing. # TTC";;;# TTC;"821675235615395840";https://twitter.com/TTCnotices/status/821675235615395840
19025957;TTCnotices;2017-01-18;05:58;1;1;"501 Queen holding eastbound at Queen and Connaught due to a stalled streetcar. # TTC";;;# TTC;"821673059551707136";https://twitter.com/TTCnotices/status/821673059551707136
19025957;TTCnotices;2017-01-17;08:07;1;0;"ALL CLEAR: The delay at Queen and Kingston has cleared. 501 Queen route has returned to regular routing. # TTC";;;# TTC;"821343134311387137";https://twitter.com/TTCnotices/status/821343134311387137
19025957;TTCnotices;2017-01-17;07:56;1;0;"501 Queen route is holding westbound at Queen and Kingston due to a medical emergency on board a streetcar. # TTC";;;# TTC;"821340515354497024";https://twitter.com/TTCnotices/status/821340515354497024
19025957;TTCnotices;2017-01-15;07:50;0;1;"ALL CLEAR: The delay at Queen and Bay has cleared. 501 Queen has returned to regular routing. # TTC";;;# TTC;"820614166385983488";https://twitter.com/TTCnotices/status/820614166385983488
19025957;TTCnotices;2017-01-15;07:47;0;0;"501 Queen route holding westbound on Queen at Bay, due to a police investigation on board a streetcar. # TTC";;;# TTC;"820613422635163648";https://twitter.com/TTCnotices/status/820613422635163648
19025957;TTCnotices;2017-01-14;21:33;0;1;"ALL CLEAR: The delay at Queen and Shaw has cleared. 501 Queen has returned to regular routing. # TTC";;;# TTC;"820458919457914880";https://twitter.com/TTCnotices/status/820458919457914880
19025957;TTCnotices;2017-01-14;21:12;1;0;"501 Queen route holding eastbound on Queen at Shaw due to security incident on board a streetcar. # TTC";;;# TTC;"820453654243274753";https://twitter.com/TTCnotices/status/820453654243274753
19025957;TTCnotices;2017-01-14;12:23;0;1;"ALL CLEAR: The delay at Queen and Dufferin has cleared. 501 Queen has returned to regular routing. # TTC";;;# TTC;"820320383538786304";https://twitter.com/TTCnotices/status/820320383538786304
19025957;TTCnotices;2017-01-14;11:59;0;2;"501 Queen diverting both ways via King, Shaw due to a collision blocking the rails at Queen and Dufferin. # TTC";;;# TTC;"820314332382855169";https://twitter.com/TTCnotices/status/820314332382855169
19025957;TTCnotices;2017-01-13;23:29;0;2;"ALL CLEAR: The delay at Queen and Niagara has cleared. 501 Queen has returned to regular routing. # TTC";;;# TTC;"820125544721371136";https://twitter.com/TTCnotices/status/820125544721371136
19025957;TTCnotices;2017-01-13;22:58;0;0;"501 Queen diverting eastbound via Shaw, King, Spadina, due to a collision at Queen and Niagara. # TTC";;;# TTC;"820117832159690752";https://twitter.com/TTCnotices/status/820117832159690752
19025957;TTCnotices;2017-01-13;20:03;0;0;"ALL CLEAR: The delay at Queen and Carlaw has cleared. 501 Queen has returned to regular routing. # TTC";;;# TTC;"820073698120101889";https://twitter.com/TTCnotices/status/820073698120101889
19025957;TTCnotices;2017-01-13;19:59;0;0;"501 Queen diverting westbound via Coxwell, Gerrard, Broadview due to collision at Queen and Carlaw. # TTC";;;# TTC;"820072735493734401";https://twitter.com/TTCnotices/status/820072735493734401
19025957;TTCnotices;2017-01-13;19:54;0;1;"501 Queen holding westbound on Queen at Carlaw due to vehicle blocking the rail. # TTC";;;# TTC;"820071454574313472";https://twitter.com/TTCnotices/status/820071454574313472
19025957;TTCnotices;2017-01-13;17:28;1;0;"ALL CLEAR: The delay at Queen and Empire has cleared. 501 Queen has returned to regular routing. # TTC";;;# TTC;"820034760500277249";https://twitter.com/TTCnotices/status/820034760500277249
19025957;TTCnotices;2017-01-13;17:06;3;0;"501 Queen diverting westbound via Coxwell, Gerrard, Broadview due to collision at Queen and Empire. # TTC";;;# TTC;"820029230687940609";https://twitter.com/TTCnotices/status/820029230687940609
19025957;TTCnotices;2017-01-13;09:01;0;0;"501 Queen Service Change Jan 8-2017, Buses replace Streetcars west of Roncesvalles, visit www. ttc.ca for further information # TTC";;;# TTC;"819907337074966528";https://twitter.com/TTCnotices/status/819907337074966528
19025957;TTCnotices;2017-01-12;18:08;0;0;"ALL CLEAR: The delay at Queen and John has cleared. 501 Queen has resumed regular routing. # TTC";;;# TTC;"819682588650565633";https://twitter.com/TTCnotices/status/819682588650565633
19025957;TTCnotices;2017-01-12;18:03;3;2;"501 Queen route holding westbound at Queen and John, near University, due to a police investigation on board a streetcar. # TTC";;;# TTC;"819681115673915392";https://twitter.com/TTCnotices/status/819681115673915392
19025957;TTCnotices;2017-01-12;09:01;0;0;"501 Queen Service Change Jan 8-2017, Buses replace Streetcars west of Roncesvalles, visit www. ttc.ca for further information # TTC";;;# TTC;"819544894058463232";https://twitter.com/TTCnotices/status/819544894058463232
19025957;TTCnotices;2017-01-11;17:52;0;0;"ALL CLEAR: The delay at Queen and University has cleared. 501 Queen has resumed regular routing. # TTC";;;# TTC;"819316003704279042";https://twitter.com/TTCnotices/status/819316003704279042
19025957;TTCnotices;2017-01-11;17:35;0;0;"501 Queen route holding westbound at Queen and University, due to a stalled streetcar. # TTC";;;# TTC;"819311676780609536";https://twitter.com/TTCnotices/status/819311676780609536
19025957;TTCnotices;2017-01-11;09:01;0;3;"501 Queen Service Change Jan 8-2017, Buses replace Streetcars west of Roncesvalles, visit www. ttc.ca for further information # TTC";;;# TTC;"819182531069218816";https://twitter.com/TTCnotices/status/819182531069218816
19025957;TTCnotices;2017-01-11;00:26;0;1;"ALL CLEAR: The delay at Queen and Silver Birch has now cleared and full service on the 501 Queen service has resumed. # TTC";;;# TTC;"819052910076116993";https://twitter.com/TTCnotices/status/819052910076116993
19025957;TTCnotices;2017-01-10;23:21;1;1;"501 Queen service turning back at Kingston Road due to a collision at Queen and Silver Birch. # TTC";;;# TTC;"819036500977451009";https://twitter.com/TTCnotices/status/819036500977451009
19025957;TTCnotices;2017-01-10;17:11;1;1;"ALL CLEAR: The delay at Queen and Lockwood has cleared. 501 Queen has resumed regular routing. # TTC";;;# TTC;"818943412246290432";https://twitter.com/TTCnotices/status/818943412246290432
19025957;TTCnotices;2017-01-10;17:00;1;0;"501 Queen turning back westbound at Queen and Woodbine, due to a stalled streetcar at Queen and Lockwood. # TTC";;;# TTC;"818940519149633536";https://twitter.com/TTCnotices/status/818940519149633536
19025957;TTCnotices;2017-01-10;09:01;1;0;"501 Queen Service Change Jan 8-2017, Buses replace Streetcars west of Roncesvalles, visit www. ttc.ca for further information # TTC";;;# TTC;"818820104309919744";https://twitter.com/TTCnotices/status/818820104309919744
19025957;TTCnotices;2017-01-09;18:01;0;1;"501 Queen Service Change Jan 8-2017, Buses replace Streetcars west of Roncesvalles, visit www. ttc.ca for further information # TTC";;;# TTC;"818593511394209792";https://twitter.com/TTCnotices/status/818593511394209792
19025957;TTCnotices;2017-01-09;15:58;1;0;"ALL CLEAR: The delay on Queen at Greenwood has now cleared. 501 Queen has resumed regular routing. # TTC";;;# TTC;"818562682433503232";https://twitter.com/TTCnotices/status/818562682433503232
19025957;TTCnotices;2017-01-09;15:34;0;1;"501 Queen route diverting westbound via Coxwell, Gerrard, Broadview due to a stalled streetcar on Queen at Greenwood. # TTC";;;# TTC;"818556524620550146";https://twitter.com/TTCnotices/status/818556524620550146
19025957;TTCnotices;2017-01-09;11:09;1;0;"ALL CLEAR: The delay at Queen and Lansdowne has cleared. 501 Queen has returned to regular routing. # TTC";;;# TTC;"818489942179512323";https://twitter.com/TTCnotices/status/818489942179512323
19025957;TTCnotices;2017-01-09;11:02;2;0;"501 Queen route holding westbound on Queen at Lansdowne, due to a stalled streetcar. # TTC";;;# TTC;"818488009431597056";https://twitter.com/TTCnotices/status/818488009431597056
19025957;TTCnotices;2017-01-09;06:00;4;4;"501 Queen Service Change Jan 8-2017, Buses replace Streetcars west of Roncesvalles, visit www. ttc.ca for further information # TTC";;;# TTC;"818412242299473920";https://twitter.com/TTCnotices/status/818412242299473920
19025957;TTCnotices;2017-01-08;15:01;0;1;"ALL CLEAR: The delay at Queen and Ontario has now cleared. 501 Queen has resumed regular routing. # TTC";;;# TTC;"818185816837070849";https://twitter.com/TTCnotices/status/818185816837070849
19025957;TTCnotices;2017-01-08;14:00;1;0;"501 Queen Service Change Jan 8-2017, Buses replace Streetcars west of Roncesvalles, visit www. ttc.ca for further information # TTC";;;# TTC;"818170616415186946";https://twitter.com/TTCnotices/status/818170616415186946
19025957;TTCnotices;2017-01-08;08:39;1;2;"UPDATE: 501 diverting E/B via Church, King and W/B via King, Church, Richmond, Victoria due to a TPS Investigation at Queen and Ontario # TTC";;;# TTC;"818089677035110400";https://twitter.com/TTCnotices/status/818089677035110400
19025957;TTCnotices;2017-01-08;08:02;0;1;"501 Queen route diverting both ways via Spadina, King, due to Toronto Police activity at Queen and Sherbourne. # TTC";;;# TTC;"818080408751472643";https://twitter.com/TTCnotices/status/818080408751472643
19025957;TTCnotices;2017-01-08;00:00;0;2;"501 Queen Service Change Jan 8-2017, Buses replace Streetcars west of Roncesvalles, visit www. ttc.ca for further information # TTC";;;# TTC;"817959132770799617";https://twitter.com/TTCnotices/status/817959132770799617
19025957;TTCnotices;2017-01-07;22:18;1;1;"ALL CLEAR: The delay at Lake Shore and Twenty Seventh has cleared. 501 Queen has returned to regular routing. # TTC";;;# TTC;"817933524032454656";https://twitter.com/TTCnotices/status/817933524032454656
19025957;TTCnotices;2017-01-07;21:49;0;1;"501 Queen turning back eastbound at Kipling due to a police investigation on board a streetcar at Lake Shore and Twenty Seventh. # TTC";;;# TTC;"817926201964515328";https://twitter.com/TTCnotices/status/817926201964515328
19025957;TTCnotices;2017-01-07;15:59;0;1;"ALL CLEAR: The delay on Queen at York has now cleared. 501 Queen has resumed regular routing. # TTC";;;# TTC;"817838072012435456";https://twitter.com/TTCnotices/status/817838072012435456
19025957;TTCnotices;2017-01-07;15:56;2;0;"501 Queen diverting eastbound via Spadina, King, Church due to a medical emergency on board a streetcar on Queen at York. # TTC";;;# TTC;"817837424210542592";https://twitter.com/TTCnotices/status/817837424210542592
19025957;TTCnotices;2017-01-07;12:00;1;0;"501 Queen Service Change Jan 8-2017, Buses replace Streetcars west of Roncesvalles, visit www. ttc.ca for further information # TTC";;;# TTC;"817777909163290624";https://twitter.com/TTCnotices/status/817777909163290624
19025957;TTCnotices;2017-01-07;10:37;0;0;"ALL CLEAR: The delay at Queen east of River has cleared. 501 Queen and 504 King have returned to regular routing. # TTC";;;# TTC;"817757028496052224";https://twitter.com/TTCnotices/status/817757028496052224
19025957;TTCnotices;2017-01-06;23:57;1;0;"ALL CLEAR: The delay westbound on Queen at Woodbine has cleared. 501 Queen has returned to regular routing. # TTC";;;# TTC;"817596048025808896";https://twitter.com/TTCnotices/status/817596048025808896
19025957;TTCnotices;2017-01-06;23:28;0;0;"UPDATE: 501 Queen turning back westbound at Kingston due to a collision at Queen and Woodbine. # TTC";;;# TTC;"817588604629348354";https://twitter.com/TTCnotices/status/817588604629348354
19025957;TTCnotices;2017-01-06;23:19;0;0;"501 Queen holding westbound on Queen at Woodbine due to a collision. # TTC";;;# TTC;"817586342624428032";https://twitter.com/TTCnotices/status/817586342624428032
19025957;TTCnotices;2017-01-06;11:12;0;2;"ALL CLEAR: The delay at Queensway and Sunnyside has cleared. 501 Queen has resumed regular routing. # TTC";;;# TTC;"817403486342180864";https://twitter.com/TTCnotices/status/817403486342180864
19025957;TTCnotices;2017-01-06;09:33;1;1;"501 Queen turning back at Queensway and Roncesvalles due to downed overhead wires at Queensway and Sunnyside. # TTC";;;# TTC;"817378587984666624";https://twitter.com/TTCnotices/status/817378587984666624
19025957;TTCnotices;2017-01-05;20:44;0;1;"ALL CLEAR: The delay at Queen east of Jones has cleared. 501 Queen has returned to regular routing. # TTC";;;# TTC;"817185119400292353";https://twitter.com/TTCnotices/status/817185119400292353
19025957;TTCnotices;2017-01-05;20:26;1;0;"501 Queen holding eastbound on Queen east of Jones due to a stalled streetcar. # TTC";;;# TTC;"817180504512405505";https://twitter.com/TTCnotices/status/817180504512405505
19025957;TTCnotices;2017-01-04;23:41;2;2;"ALL CLEAR: The delay at Neville Loop has now cleared and full service on the 501 Queen service has resumed. # TTC";;;# TTC;"816867208664072192";https://twitter.com/TTCnotices/status/816867208664072192
19025957;TTCnotices;2017-01-04;23:31;0;2;"501 Queen service turning back at Kingston Road due to a stalled streetcar at Neville Loop. # TTC";;;# TTC;"816864638843441152";https://twitter.com/TTCnotices/status/816864638843441152
19025957;TTCnotices;2017-01-04;11:47;0;2;"ALL CLEAR: The delay at Queen and Victoria has cleared. 501 Queen has returned to regular routing. # TTC";;;# TTC;"816687628770832389";https://twitter.com/TTCnotices/status/816687628770832389
19025957;TTCnotices;2017-01-04;11:39;1;0;"501 Queen diverting eastbound via Spadina, King, Church, due to a stalled streetcar at Queen and Victoria. # TTC";;;# TTC;"816685488434253824";https://twitter.com/TTCnotices/status/816685488434253824
19025957;TTCnotices;2017-01-04;09:19;2;1;"ALL CLEAR: The delay at The Queensway and Colborne Lodge has cleared. 501 Queen has returned to regular routing. # TTC";;;# TTC;"816650362417455105";https://twitter.com/TTCnotices/status/816650362417455105
19025957;TTCnotices;2017-01-04;08:41;3;0;"501 Queen turning back from Queen and Roncesvalles, due to a collision at The Queensway and Colborne Lodge. # TTC";;;# TTC;"816640630956949504";https://twitter.com/TTCnotices/status/816640630956949504
19025957;TTCnotices;2017-01-03;12:57;0;0;"ALL CLEAR: The delay on Lake Shore at Islington has cleared. 501 Queen has returned to regular routing. # TTC";;;# TTC;"816342710978224133";https://twitter.com/TTCnotices/status/816342710978224133
19025957;TTCnotices;2017-01-03;12:51;2;1;"UPDATE: 501 Queen streetcars are holding both ways on Lake Shore at Islington due to a collision. Shuttle buses operating. # TTC";;;# TTC;"816341207878144000";https://twitter.com/TTCnotices/status/816341207878144000
19025957;TTCnotices;2017-01-03;12:19;1;0;"501 Queen holding both ways on Lake Shore at Islington due to a collision. # TTC";;;# TTC;"816333164666818560";https://twitter.com/TTCnotices/status/816333164666818560
19025957;TTCnotices;2017-01-03;07:27;0;0;"ALL CLEAR: The delay on Lake Shore at Brown's Line has cleared. 501 Queen has returned to regular routing. # TTC";;;# TTC;"816259812124225536";https://twitter.com/TTCnotices/status/816259812124225536
19025957;TTCnotices;2017-01-03;07:04;0;0;"501 Queen turning back eastbound at Lake Shore and Kipling due to a collision on Lake Shore at Brown's Line. # TTC";;;# TTC;"816253992309293057";https://twitter.com/TTCnotices/status/816253992309293057
19025957;TTCnotices;2017-01-02;22:24;0;2;"ALL CLEAR: The delay at Lake Shore Blvd and Lake Shore Avenue has now cleared and full service on the 501 Queen service has resumed. # TTC";;;# TTC;"816123016702730241";https://twitter.com/TTCnotices/status/816123016702730241
19025957;TTCnotices;2017-01-02;21:48;0;1;"501 Queen service turning back at Kipling Loop due to a collision at Lake Shore Blvd and Lake Shore Avenue. # TTC";;;# TTC;"816114039688482816";https://twitter.com/TTCnotices/status/816114039688482816
19025957;TTCnotices;2017-01-01;20:50;0;1;"CLEAR: The delay at Queen and University has cleared. 501 Queen has returned to regular routing. # TTC";;;# TTC;"815736969988898816";https://twitter.com/TTCnotices/status/815736969988898816
19025957;TTCnotices;2017-01-01;20:47;0;0;"501 Queen service holding westbound at Queen and University, due to a police investigation on board a streetcar. # TTC";;;# TTC;"815736141261443073";https://twitter.com/TTCnotices/status/815736141261443073
19025957;TTCnotices;2017-01-01;01:39;2;5;"ALL CLEAR: The delay at Queen and Bay has cleared. 501 route has returned to regular routing. # TTC";;;# TTC;"815447217272135680";https://twitter.com/TTCnotices/status/815447217272135680
19025957;TTCnotices;2016-12-31;23:17;0;0;"501 Queen diverting BW via Spadina, King, Church, due to New Years Eve Festivities at Queen and Bay. # TTC";;;# TTC;"815411523027959808";https://twitter.com/TTCnotices/status/815411523027959808
19025957;TTCnotices;2016-12-31;21:55;0;2;"501 Queen diverting both ways via Spadina, King, Church, due to New Years Eve Festivities at Queen and Bay.";;;;"815390984934658050";https://twitter.com/TTCnotices/status/815390984934658050
19025957;TTCnotices;2016-12-31;21:12;0;0;"501 Queen diverting both ways via Spadina, King, Church, due to New Years Eve Festivities at Queen and Bay. # TTC";;;# TTC;"815380040942764033";https://twitter.com/TTCnotices/status/815380040942764033
19025957;TTCnotices;2016-12-31;19:04;0;1;"ALL CLEAR: The delay at Lakeshore and 31st has cleared. 501 Queen has resumed regular routing in the west end. # TTC";;;# TTC;"815348026340442112";https://twitter.com/TTCnotices/status/815348026340442112