userid;username;date;time;retweets;favorites;text;geo;mentions;hashtags;tweetid;permalink
19025957;TTCnotices;2017-03-05;07:36;0;0;"501 Queen route diverting both ways via Spadina, King, Shaw due to a police investigation on Spadina at Adelaide. # TTC";;;# TTC;"838367508524597250";https://twitter.com/TTCnotices/status/838367508524597250
19025957;TTCnotices;2017-03-04;20:34;0;2;"ALL CLEAR: The delay at Queen and Simcoe has cleared. 501 Queen has returned to regular routing. # TTC";;;# TTC;"838200898463596544";https://twitter.com/TTCnotices/status/838200898463596544
19025957;TTCnotices;2017-03-04;19:36;0;0;"501 Queen route diverting westbound via Church, King, Spadina, due to a stalled streetcar at Queen and Simcoe. # TTC";;;# TTC;"838186320220553218";https://twitter.com/TTCnotices/status/838186320220553218
19025957;TTCnotices;2017-03-04;13:15;1;1;"ALL CLEAR: The delay at Queen and O'Hara has cleared. 501 Queen has returned to regular routing. # TTC";;;# TTC;"838090592664051712";https://twitter.com/TTCnotices/status/838090592664051712
19025957;TTCnotices;2017-03-04;12:42;0;0;"501 Queen diverting westbound via Shaw, King, due to a collision investigation at Queen and O'Hara. # TTC";;;# TTC;"838082275828985857";https://twitter.com/TTCnotices/status/838082275828985857
19025957;TTCnotices;2017-03-04;12:41;0;1;"501 Queen holding westbound on Queen at O'Hara due to a collision investigation. # TTC";;;# TTC;"838081993866948608";https://twitter.com/TTCnotices/status/838081993866948608
19025957;TTCnotices;2017-03-02;20:07;0;1;"ALL CLEAR: The delay on Queen and Church has now cleared. 501 Queen has resumed regular routing. # TTC";;;# TTC;"837469551868719104";https://twitter.com/TTCnotices/status/837469551868719104
19025957;TTCnotices;2017-03-02;19:34;0;0;"501 Queen route holding westbound on Queen and Church due to a security incident on board a streetcar. # TTC";;;# TTC;"837461137096642561";https://twitter.com/TTCnotices/status/837461137096642561
19025957;TTCnotices;2017-03-02;08:55;0;0;"ALL CLEAR: The delay at Queen and Dufferin has cleared. 501 Queen has returned to regular routing. # TTC";;;# TTC;"837300376869224448";https://twitter.com/TTCnotices/status/837300376869224448
19025957;TTCnotices;2017-03-02;08:52;0;0;"501 Queen diverting westbound via Shaw, King due to a disabled auto blocking the road at Queen and Dufferin. # TTC";;;# TTC;"837299475421007872";https://twitter.com/TTCnotices/status/837299475421007872
19025957;TTCnotices;2017-03-01;17:19;0;0;"ALL CLEAR: The delay at Queen and Greenwood has cleared. 501 Queen has returned to regular routing. # TTC";;;# TTC;"837064901872996352";https://twitter.com/TTCnotices/status/837064901872996352
19025957;TTCnotices;2017-03-01;17:03;1;0;"501 Queen route holding westbound on Queen at Greenwood, due to a medical emergency on board. # TTC";;;# TTC;"837060814762881028";https://twitter.com/TTCnotices/status/837060814762881028
19025957;TTCnotices;2017-03-01;08:49;2;0;"ALL CLEAR: The delay at Queen and Empire has cleared. 501 Queen route has returned to regular routing. # TTC";;;# TTC;"836936554291539968";https://twitter.com/TTCnotices/status/836936554291539968
19025957;TTCnotices;2017-03-01;08:41;3;0;"501 Queen is diverting EB via Broadview, Gerrard, Coxwell due to a mechanical issue on board a streetcar at Queen & Empire. # TTC";;;# TTC;"836934463141588995";https://twitter.com/TTCnotices/status/836934463141588995
19025957;TTCnotices;2017-02-28;11:23;2;1;"501 Queen diverting westbound via Parliament, King, Church due to a medical emergency on board streetcar at Queen and Ontario. # TTC";;;# TTC;"836612739065868288";https://twitter.com/TTCnotices/status/836612739065868288
19025957;TTCnotices;2017-02-27;12:23;0;0;"ALL CLEAR: The delay at Queen and Logan has cleared. 501 Queen has returned to regular routing. # TTC";;;# TTC;"836265600347422720";https://twitter.com/TTCnotices/status/836265600347422720
19025957;TTCnotices;2017-02-27;12:13;0;0;"501 Queen holding both ways on Queen at Logan due to a stalled auto blocking the rails. # TTC";;;# TTC;"836262922791833603";https://twitter.com/TTCnotices/status/836262922791833603
19025957;TTCnotices;2017-02-25;05:11;0;0;"ALL CLEAR: The delay at Neville Loop has now cleared and full service on the 501 Queen service has resumed. # TTC";;;# TTC;"835432116016066561";https://twitter.com/TTCnotices/status/835432116016066561
19025957;TTCnotices;2017-02-25;04:50;0;2;"501 Queen service turning back at Kingston Road due to a security incident on a streetcar at Neville Loop.";;;;"835426630889799681";https://twitter.com/TTCnotices/status/835426630889799681
19025957;TTCnotices;2017-02-24;23:17;0;0;"ALL CLEAR: The delay both ways at Queen and Yonge has now cleared and full service on the 501 Queen service has resumed. # TTC";;;# TTC;"835343029787582464";https://twitter.com/TTCnotices/status/835343029787582464
19025957;TTCnotices;2017-02-24;21:11;0;0;"501 Queen diverting E/B via Spadina, King, Church and W/B via Church, King, York, due to a gas leak at Queen and Yonge. # TTC";;;# TTC;"835311143929462789";https://twitter.com/TTCnotices/status/835311143929462789
19025957;TTCnotices;2017-02-24;13:59;0;0;"ALL CLEAR: The delay at Queen and Gladstone has cleared. 501 Queen has resumed regular routing. # TTC";;;# TTC;"835202562248826882";https://twitter.com/TTCnotices/status/835202562248826882
19025957;TTCnotices;2017-02-24;13:57;0;1;"501 Queen diverting eastbound via King, Shaw, due to a stalled truck blocking the rails at Queen and Gladstone. # TTC";;;# TTC;"835202057342693380";https://twitter.com/TTCnotices/status/835202057342693380
19025957;TTCnotices;2017-02-23;21:16;0;0;"ALL CLEAR: The delay on Queen at Wineva has now cleared. 501 Queen has resumed regular routing. # TTC";;;# TTC;"834950207519535104";https://twitter.com/TTCnotices/status/834950207519535104
19025957;TTCnotices;2017-02-23;20:12;0;2;"501 Queen turning back westbound from Kingston Road due to autos in collision on Queen at Wineva. # TTC";;;# TTC;"834934045595287552";https://twitter.com/TTCnotices/status/834934045595287552
19025957;TTCnotices;2017-02-23;14:15;1;0;"ALL CLEAR: The delay on Queen at Brooklyn has now cleared. 501 Queen has resumed regular routing. # TTC";;;# TTC;"834844033155489795";https://twitter.com/TTCnotices/status/834844033155489795
19025957;TTCnotices;2017-02-23;14:06;0;0;"501 Queen route holding westbound on Queen at Brooklyn due to a stalled streetcar. # TTC";;;# TTC;"834841769334431748";https://twitter.com/TTCnotices/status/834841769334431748
19025957;TTCnotices;2017-02-22;12:16;0;1;"ALL CLEAR: The delay at Queen and Victoria has cleared. 501 Queen route has returned to regular routing. # TTC";;;# TTC;"834451923176738816";https://twitter.com/TTCnotices/status/834451923176738816
19025957;TTCnotices;2017-02-22;12:01;1;0;"501 Queen is diverting eastbound via McCaul, Dundas, Victoria due to a collision at Queen & Victoria. # TTC";;;# TTC;"834448141625749504";https://twitter.com/TTCnotices/status/834448141625749504
19025957;TTCnotices;2017-02-21;19:09;0;0;"ALL CLEAR: The delay on Queen at Glen Manor has now cleared. 501 Queen has resumed regular routing. # TTC";;;# TTC;"834193460005634048";https://twitter.com/TTCnotices/status/834193460005634048
19025957;TTCnotices;2017-02-21;18:48;0;0;"501 Queen route holding westbound on Queen at Glen Manor due to a stalled streetcar. # TTC";;;# TTC;"834188194568630274";https://twitter.com/TTCnotices/status/834188194568630274
19025957;TTCnotices;2017-02-21;14:06;1;1;"ALL CLEAR: The delay on Queen at St Patrick has now cleared. 501 Queen has resumed regular routing. # TTC";;;# TTC;"834117119839203330";https://twitter.com/TTCnotices/status/834117119839203330
19025957;TTCnotices;2017-02-21;13:39;1;2;"UPDATE: 501 Queen diverting westbound via Spadina, King, Church due to a Toronto Fire investigation on Queen at St Patrick. # TTC";;;# TTC;"834110293659807746";https://twitter.com/TTCnotices/status/834110293659807746
19025957;TTCnotices;2017-02-21;13:31;2;0;"501 Queen diverting both ways via Spadina, King, Church due to a Toronto Fire investigation on Queen at St Patrick. # TTC";;;# TTC;"834108208226635777";https://twitter.com/TTCnotices/status/834108208226635777
19025957;TTCnotices;2017-02-19;15:34;0;0;"501 Queen holding westbound at Queen and Yonge due to a TPS investigation on board the streetcar. # TTC";;;# TTC;"833414507619876864";https://twitter.com/TTCnotices/status/833414507619876864
19025957;TTCnotices;2017-02-19;12:42;0;0;"ALL CLEAR: The delay westbound on Queen at Yonge has cleared. 501 Queen has returned to regular routing. # TTC";;;# TTC;"833371302484377600";https://twitter.com/TTCnotices/status/833371302484377600
19025957;TTCnotices;2017-02-19;12:34;0;0;"UPDATE: 501 Queen diverting westbound via Church, King, York, due to a stalled streetcar on Queen at Yonge. # TTC";;;# TTC;"833369172457439237";https://twitter.com/TTCnotices/status/833369172457439237
19025957;TTCnotices;2017-02-19;12:31;0;0;"501 Queen holding westbound on Queen at Yonge due to a stalled streetcar. # TTC";;;# TTC;"833368324776087553";https://twitter.com/TTCnotices/status/833368324776087553
19025957;TTCnotices;2017-02-17;22:37;1;1;"ALL CLEAR: The delay at Queen and Augusta has cleared. 501 Queen has returned to regular routing. # TTC";;;# TTC;"832796140626014208";https://twitter.com/TTCnotices/status/832796140626014208
19025957;TTCnotices;2017-02-17;21:43;0;0;"501 Queen diverting westbound via Spadina, King, Shaw, due to an auto blocking the rails at Queen and Augusta. # TTC";;;# TTC;"832782531233619969";https://twitter.com/TTCnotices/status/832782531233619969
19025957;TTCnotices;2017-02-17;20:31;0;1;"501 Queen diverting westbound via Spadina, King, Shaw, due to a auto blocking the rails at Queen and Augusta. # TTC";;;# TTC;"832764458615312384";https://twitter.com/TTCnotices/status/832764458615312384
19025957;TTCnotices;2017-02-17;02:00;0;2;"ALL CLEAR: The delay at Queen and Kippendavie has cleared. 501 Queen has returned to regular routing. # TTC";;;# TTC;"832484755228618752";https://twitter.com/TTCnotices/status/832484755228618752
19025957;TTCnotices;2017-02-17;01:03;1;1;"501 Queen turning back eastbound at Woodbine Loop due to a stalled streetcar at Queen and Kippendavie. # TTC";;;# TTC;"832470619350458368";https://twitter.com/TTCnotices/status/832470619350458368
19025957;TTCnotices;2017-02-16;07:13;3;1;"ALL CLEAR: The delay at Queen and Greenwood has cleared. 501 Queen has returned to regular routing. # TTC";;;# TTC;"832201282198917121";https://twitter.com/TTCnotices/status/832201282198917121
19025957;TTCnotices;2017-02-16;05:35;5;3;"501 Queen diverting westbound via Coxwell, Gerrard, Broadview due to overhead issues at Queen and Greenwood. # TTC";;;# TTC;"832176566180388866";https://twitter.com/TTCnotices/status/832176566180388866
19025957;TTCnotices;2017-02-15;14:16;1;0;"ALL CLEAR: The delay at Queen and Carlaw has cleared. 501 Queen has resumed regular routing. # TTC";;;# TTC;"831945368766136320";https://twitter.com/TTCnotices/status/831945368766136320
19025957;TTCnotices;2017-02-15;13:41;0;0;"501 Queen route diverting eastbound via Broadview, Gerrard, Coxwell, due to a collision at Queen and Carlaw. # TTC";;;# TTC;"831936555279323136";https://twitter.com/TTCnotices/status/831936555279323136
19025957;TTCnotices;2017-02-14;16:31;0;1;"ALL CLEAR: The delay on Queen at Augusta has now cleared. 501 Queen has resumed regular routing. # TTC";;;# TTC;"831616917332967424";https://twitter.com/TTCnotices/status/831616917332967424
19025957;TTCnotices;2017-02-14;16:27;1;3;"501 Queen route diverting eastbound via Shaw, King, Spadina due to a security incident on board a streetcar on Queen at Augusta. # TTC";;;# TTC;"831615844409020416";https://twitter.com/TTCnotices/status/831615844409020416
19025957;TTCnotices;2017-02-12;12:52;0;0;"ALL CLEAR: The delay eastbound on Queen at Augusta has cleared. 501 Queen has returned to regular routing. # TTC";;;# TTC;"830836874520428546";https://twitter.com/TTCnotices/status/830836874520428546
19025957;TTCnotices;2017-02-12;12:28;2;0;"501 Queen diverting eastbound via Shaw, King, Spadina, due to a collision on Queen at Augusta. # TTC";;;# TTC;"830830891467423744";https://twitter.com/TTCnotices/status/830830891467423744
19025957;TTCnotices;2017-02-11;14:04;0;0;"ALL CLEAR: The delay at Neville and Queen has cleared. 501 Queen has returned to regular routing. # TTC";;;# TTC;"830492765935063040";https://twitter.com/TTCnotices/status/830492765935063040
19025957;TTCnotices;2017-02-11;13:47;0;0;"501 Queen route turning back at Kingston Road, due to a stalled streetcar at Neville and Queen. # TTC";;;# TTC;"830488489737252866";https://twitter.com/TTCnotices/status/830488489737252866
19025957;TTCnotices;2017-02-09;12:10;0;0;"ALL CLEAR: The delay at Queen and Bathurst has cleared. 501 Queen has returned to regular routing. # TTC";;;# TTC;"829739320198254594";https://twitter.com/TTCnotices/status/829739320198254594
19025957;TTCnotices;2017-02-09;12:04;0;0;"UPDATE: 501 Queen diverting westbound via Spadina, King, Shaw, due to a stalled streetcar at Queen and Bathurst. # TTC";;;# TTC;"829737719773425665";https://twitter.com/TTCnotices/status/829737719773425665
19025957;TTCnotices;2017-02-09;11:48;0;1;"501 Queen holding westbound at Queen and Bathurst due to a stalled streetcar. # TTC";;;# TTC;"829733833792749569";https://twitter.com/TTCnotices/status/829733833792749569
19025957;TTCnotices;2017-02-07;21:58;9;6;"501 Queen, 505 Dundas, 506 Carlton streetcars have returned to normal operating state. # TTC";;;# TTC;"829162452269092864";https://twitter.com/TTCnotices/status/829162452269092864
19025957;TTCnotices;2017-02-07;21:02;5;1;"Average minute delay on streetcar lines 501 Queen (20), 504 King (10), 505 Dundas (15), 506 Carlton (15), 510 Spadina (12), 512 St Clair(8).";;;;"829148271025152000";https://twitter.com/TTCnotices/status/829148271025152000
19025957;TTCnotices;2017-02-07;20:50;2;1;"Significant delays continue on 501 Queen,505 Dundas,506 Carlton due to freezing rain. Buses utilized to augment streetcar service.";;;;"829145243186388992";https://twitter.com/TTCnotices/status/829145243186388992
19025957;TTCnotices;2017-02-07;20:09;3;3;"Significant delays continue on 501 Queen, 505 Dundas, 506 Carlton due to freezing rain. Buses utilized to augment streetcar service. # TTC";;;# TTC;"829135109198639104";https://twitter.com/TTCnotices/status/829135109198639104
19025957;TTCnotices;2017-02-07;19:50;4;3;"Additional bus service provided on 501 Queen, 504 King, 505 Dundas, 506 Carlton & 512 St Clair routes to supplement streetcar service.";;;;"829130170456010756";https://twitter.com/TTCnotices/status/829130170456010756
19025957;TTCnotices;2017-02-07;19:06;1;2;"Additional bus service provided on 501 Queen, 504 King, 505 Dundas, 506 Carlton & 512 St Clair routes to supplement streetcar service. # TTC";;;# TTC;"829119089192890368";https://twitter.com/TTCnotices/status/829119089192890368
19025957;TTCnotices;2017-02-07;18:31;2;3;"Additional bus service is being provided on 501 Queen,504 King,505 Dundas,506 Carlton, 512 St Clair routes to supplement streetcar service.";;;;"829110409508552705";https://twitter.com/TTCnotices/status/829110409508552705
19025957;TTCnotices;2017-02-07;17:53;4;7;"Additional bus service being provided on 501 Queen,504 King,505 Dundas,506 Carlton,512 St Clair routes to supplement streetcar service. # TTC";;;# TTC;"829100711094915073";https://twitter.com/TTCnotices/status/829100711094915073
19025957;TTCnotices;2017-02-07;17:25;7;4;"Additional bus service is being provided on 501 Queen,504 King,505 Dundas,506 Carlton & 512 St Clair routes to supplement streetcar service.";;;;"829093651716386816";https://twitter.com/TTCnotices/status/829093651716386816
19025957;TTCnotices;2017-02-07;16:25;7;8;"Additional bus service on 501 Queen, 504 King, 505 Dundas, 506 Carlton routes to supplement streetcar service. # TTC";;;# TTC;"829078582534213636";https://twitter.com/TTCnotices/status/829078582534213636
19025957;TTCnotices;2017-02-07;16:10;5;5;"Additional bus service on 501 Queen, 504 King, 505 Dundas, 506 Carlton routes to supplement streetcar service. # TTC";;;# TTC;"829074766124425218";https://twitter.com/TTCnotices/status/829074766124425218
19025957;TTCnotices;2017-02-07;14:24;6;6;"501 Queen, 506 Carlton and 509 Harbourfront routes experiencing extreme delays due to icy overhead conditions. # TTC";;;# TTC;"829048256537751553";https://twitter.com/TTCnotices/status/829048256537751553
19025957;TTCnotices;2017-02-07;14:02;0;0;"501 Queen route holding eastbound on Queen at Parliament due to a collision. # TTC";;;# TTC;"829042587055054848";https://twitter.com/TTCnotices/status/829042587055054848
19025957;TTCnotices;2017-02-06;16:39;0;1;"ALL CLEAR: The delay at Queen and Parliament has cleared. 501 Queen has resumed regular routing. # TTC";;;# TTC;"828719808334221312";https://twitter.com/TTCnotices/status/828719808334221312
19025957;TTCnotices;2017-02-06;16:15;0;0;"501 Queen route diverting eastbound via Church, King, Broadview, due to a stalled streetcar at Queen and Parliament. # TTC";;;# TTC;"828713819681783808";https://twitter.com/TTCnotices/status/828713819681783808
19025957;TTCnotices;2017-02-06;10:42;1;0;"ALL CLEAR: The delay at McCaul Loop has cleared. 501 Queen route has returned to regular routing. # TTC";;;# TTC;"828629856233652224";https://twitter.com/TTCnotices/status/828629856233652224
19025957;TTCnotices;2017-02-06;10:16;0;1;"ALL CLEAR: The delay at Queen and DVP has cleared. 501 Queen & 504 King routes have returned to regular routing. # TTC";;;# TTC;"828623291036397568";https://twitter.com/TTCnotices/status/828623291036397568
19025957;TTCnotices;2017-02-06;10:15;0;1;"501 Queen route is holding at McCaul Loop due to a stalled auto blocking the rails. # TTC.";;;# TTC.;"828623218936279040";https://twitter.com/TTCnotices/status/828623218936279040
19025957;TTCnotices;2017-02-06;09:56;0;0;"501 Queen & 504 King route are diverting eastbound via Parliament, Dundas, Broadview due to a collision on Queen at DVP. # TTC";;;# TTC;"828618326901399552";https://twitter.com/TTCnotices/status/828618326901399552
19025957;TTCnotices;2017-02-06;09:44;1;0;"ALL CLEAR: The delay at Queen and Parliament has cleared. 501 Queen route has returned to regular routing. # TTC";;;# TTC;"828615299050196992";https://twitter.com/TTCnotices/status/828615299050196992
19025957;TTCnotices;2017-02-06;09:09;2;0;"501 Queen diverting WB via Broadview, Dundas, Parliament due to a collision blocking the rails at Queen & Parliament. Shuttle buses running.";;;;"828606499241000960";https://twitter.com/TTCnotices/status/828606499241000960
19025957;TTCnotices;2017-02-05;08:15;0;1;"ALL CLEAR: The delay at Queen and Dowling has cleared. 501 Queen has returned to regular routing. # TTC";;;# TTC;"828230598498070528";https://twitter.com/TTCnotices/status/828230598498070528
19025957;TTCnotices;2017-02-05;08:02;0;1;"501 Queen diverting eastbound via King, Dufferin, due to a collision at Queen and Dowling. # TTC";;;# TTC;"828227253792284676";https://twitter.com/TTCnotices/status/828227253792284676
19025957;TTCnotices;2017-02-04;17:21;0;1;"ALL CLEAR: The delay on University Avenue has now cleared. 501 Queen has resumed regular routing. # TTC";;;# TTC;"828005515162746885";https://twitter.com/TTCnotices/status/828005515162746885
19025957;TTCnotices;2017-02-04;16:23;0;0;"ALL CLEAR: The delay on Queen and Claremont has now cleared. 501 Queen has resumed regular routing. # TTC";;;# TTC;"827991009304969216";https://twitter.com/TTCnotices/status/827991009304969216
19025957;TTCnotices;2017-02-04;16:18;0;1;"501 Queen route holding westbound on Queen at Claremont due to a security incident on board a streetcar. # TTC";;;# TTC;"827989711612428290";https://twitter.com/TTCnotices/status/827989711612428290
19025957;TTCnotices;2017-02-04;12:34;1;0;"501 Queen diverting both ways via Spadina, King, Church, due to a Protest on University Avenue. # TTC";;;# TTC;"827933261263413252";https://twitter.com/TTCnotices/status/827933261263413252
19025957;TTCnotices;2017-02-03;18:00;0;0;"ALL CLEAR: The delay at Queen and Logan has cleared. 501 Queen has returned to regular routing. # TTC";;;# TTC;"827652949035855872";https://twitter.com/TTCnotices/status/827652949035855872
19025957;TTCnotices;2017-02-03;17:20;0;0;"501 Queen holding westbound on Queen at Logan due to a stalled streetcar. # TTC";;;# TTC;"827642869368381440";https://twitter.com/TTCnotices/status/827642869368381440
19025957;TTCnotices;2017-02-03;14:23;0;0;"ALL CLEAR: The delay at Queen and Broadview has cleared. 501 Queen has returned to regular routing. # TTC";;;# TTC;"827598378846519296";https://twitter.com/TTCnotices/status/827598378846519296
19025957;TTCnotices;2017-02-03;14:21;0;0;"501 Queen holding westbound on Queen at Broadview due to a stalled streetcar. # TTC";;;# TTC;"827598010758623234";https://twitter.com/TTCnotices/status/827598010758623234
19025957;TTCnotices;2017-02-03;06:20;2;1;"ALL CLEAR: The delay at Queen and York has cleared. 501 Queen has returned to regular routing. # TTC";;;# TTC;"827476941053841413";https://twitter.com/TTCnotices/status/827476941053841413
19025957;TTCnotices;2017-02-03;06:15;2;1;"501 Queen holding westbound at Queen and York, due to a stalled streetcar. # TTC";;;# TTC;"827475586582978560";https://twitter.com/TTCnotices/status/827475586582978560
19025957;TTCnotices;2017-01-31;17:47;0;1;"ALL CLEAR: The delay at Lake Shore and Long Branch has cleared. 501 Queen has resumed regular routing. # TTC";;;# TTC;"826562602994171904";https://twitter.com/TTCnotices/status/826562602994171904
19025957;TTCnotices;2017-01-31;17:23;1;0;"501 Queen route diverting eastbound via 35th, Marina, 33rd, due to a collision at Lake Shore and Long Branch. # TTC";;;# TTC;"826556577461182464";https://twitter.com/TTCnotices/status/826556577461182464
19025957;TTCnotices;2017-01-31;14:54;1;1;"ALL CLEAR: The delay at Queen and Yonge has cleared. 501 Queen has resumed regular routing. # TTC";;;# TTC;"826518995851436032";https://twitter.com/TTCnotices/status/826518995851436032
19025957;TTCnotices;2017-01-31;14:34;0;1;"501 Queen route holding eastbound at Queen and Yonge, due to a medical emergency on board a streetcar. # TTC";;;# TTC;"826514003790815235";https://twitter.com/TTCnotices/status/826514003790815235
19025957;TTCnotices;2017-01-31;14:32;1;1;"ALL CLEAR: The delay at Queen and Coxwell has cleared. 501 Queen and 502 Downtowner have resumed regular routing. # TTC";;;# TTC;"826513566928887809";https://twitter.com/TTCnotices/status/826513566928887809
19025957;TTCnotices;2017-01-31;14:17;1;0;"501 Queen and 502 Downtowner routes holding both ways at Queen and Coxwell, due to a fire investigation. # TTC";;;# TTC;"826509738531778560";https://twitter.com/TTCnotices/status/826509738531778560
19025957;TTCnotices;2017-01-31;09:59;1;0;"ALL CLEAR: The delay at Queen and Leslie has cleared. 501 Queen has returned to regular routing. # TTC";;;# TTC;"826444861289136129";https://twitter.com/TTCnotices/status/826444861289136129
19025957;TTCnotices;2017-01-31;09:54;0;0;"501 Queen route holding eastbound on Queen at Leslie, due to a stalled streetcar. # TTC";;;# TTC;"826443599894151168";https://twitter.com/TTCnotices/status/826443599894151168
19025957;TTCnotices;2017-01-30;19:35;0;1;"ALL CLEAR: The delay at Queen and Leslie has cleared. 501 Queen has resumed regular routing. # TTC";;;# TTC;"826227331031252993";https://twitter.com/TTCnotices/status/826227331031252993
19025957;TTCnotices;2017-01-30;19:01;0;0;"501 Queen route diverting westbound via Coxwell, Gerrard, Broadview, due to a collision at Queen and Leslie. # TTC";;;# TTC;"826218705638064129";https://twitter.com/TTCnotices/status/826218705638064129
19025957;TTCnotices;2017-01-29;02:16;0;0;"ALL CLEAR: The delay at Neville Park Loop has cleared. 501 Queen has returned to regular routing. # TTC";;;# TTC;"825603406173765632";https://twitter.com/TTCnotices/status/825603406173765632
19025957;TTCnotices;2017-01-29;01:57;0;0;"501 Queen turning back westbound at Queen and Kingston due to a police investigation on board a streetcar at Neville Park Loop. # TTC";;;# TTC;"825598622137999360";https://twitter.com/TTCnotices/status/825598622137999360
19025957;TTCnotices;2017-01-29;01:50;0;1;"501 Queen holding westbound at Neville Park Loop due to a police investigation on board a streetcar. # TTC";;;# TTC;"825597006445961216";https://twitter.com/TTCnotices/status/825597006445961216
19025957;TTCnotices;2017-01-27;20:02;0;0;"ALL CLEAR: The delay at Queen and Crawford has cleared. 501 Queen has resumed regular routing. # TTC";;;# TTC;"825146977688100864";https://twitter.com/TTCnotices/status/825146977688100864
19025957;TTCnotices;2017-01-27;19:56;0;0;"501 Queen diverting both ways via Shaw, King, Spadina, due to a TFS Investigation at Queen and Crawford. # TTC";;;# TTC;"825145602094796800";https://twitter.com/TTCnotices/status/825145602094796800
19025957;TTCnotices;2017-01-27;18:54;0;1;"ALL CLEAR: The delay at Queen and Yonge has cleared. 501 Queen has returned to regular routing. # TTC";;;# TTC;"825129884947251204";https://twitter.com/TTCnotices/status/825129884947251204
19025957;TTCnotices;2017-01-27;18:35;0;1;"501 Queen diverting westbound via Church, King, York due to medical emergency on a streetcar at Queen and Yonge. # TTC";;;# TTC;"825125103344160768";https://twitter.com/TTCnotices/status/825125103344160768
19025957;TTCnotices;2017-01-27;07:27;1;1;"ALL CLEAR: The delay at Queen near Dufferin has cleared. 501 Queen has returned to regular routing. # TTC";;;# TTC;"824956906393464832";https://twitter.com/TTCnotices/status/824956906393464832
19025957;TTCnotices;2017-01-27;06:58;1;0;"501 Queen holding westbound at Queen near Dufferin, due to a stalled streetcar. Shuttle buses operating. # TTC";;;# TTC;"824949708045041665";https://twitter.com/TTCnotices/status/824949708045041665
